{
  "exam_id": "usmle-step2ck",
  "name": "USMLE Step 2 Clinical Knowledge",
  "description": "Clinical science applied to patient care under supervision. Three-digit score reported. System weights below are the official 2026 specification (crawled from usmle.org by pipeline/crawl).",
  "official_url": "https://www.usmle.org/exam-resources/step-2-ck-materials/step-2-ck-content-outline-specifications",
  "verified_at": "2026-10-08",
  "facts": [
    { "key": "scoring", "value": "Three-digit score; passing standard 214 (effective July 2024)", "source_url": "https://www.usmle.org/scores-transcripts/examination-results-and-scoring", "verified_at": "2026-10-08" },
    { "key": "format", "value": "One-day exam, 8 blocks of 60 minutes, up to 318 items, 9-hour session", "source_url": "https://www.usmle.org/step-exams/step-2-ck", "verified_at": "2026-10-08" },
    { "key": "fee_usd", "value": "695 (2026) for US/Canadian students; ECFMG applicants pay ECFMG fee schedule plus international surcharge", "source_url": "https://www.usmle.org/apply-exams", "verified_at": "2026-10-08" },
    { "key": "clinical_science_mix", "value": "Medicine 55-65%, Pediatrics 17-27%, Obstetrics & Gynecology 10-20%, Psychiatry 10-15%, Surgery 5-15%", "source_url": "https://www.usmle.org/exam-resources/step-2-ck-materials/step-2-ck-content-outline-specifications", "verified_at": "2026-10-08" },
    { "key": "competency_mix", "value": "Diagnosis 16-20%, Lab/Diagnostic Studies 13-17%, Mixed Management 12-16%, Pharmacotherapy 8-12%, Clinical Interventions 6-10%, Health Maintenance 5-10%, Prognosis 5-9%, Systems-based Practice 5-7%, Professionalism 5-7%, PBLI 3-5%", "source_url": "https://www.usmle.org/exam-resources/step-2-ck-materials/step-2-ck-content-outline-specifications", "verified_at": "2026-10-08" }
  ],
  "topics": [
    { "id": "human-development", "name": "Human Development", "weight_min_pct": 2, "weight_max_pct": 4, "aliases": ["development", "well child", "aging", "geriatrics"] },
    { "id": "blood-immune", "name": "Blood & Lymphoreticular/Immune Systems", "weight_min_pct": 5, "weight_max_pct": 10, "aliases": ["hematology", "oncology", "heme/onc", "immunology", "allergy", "anemia", "lymphoma", "leukemia"] },
    { "id": "behavioral-health", "name": "Behavioral Health", "weight_min_pct": 5, "weight_max_pct": 10, "aliases": ["psychiatry", "psych", "substance use", "depression", "anxiety", "psychosis"] },
    { "id": "nervous", "name": "Nervous System & Special Senses", "weight_min_pct": 5, "weight_max_pct": 10, "aliases": ["neurology", "neuro", "ophthalmology", "ent", "stroke", "seizure", "headache"] },
    { "id": "msk-skin", "name": "Musculoskeletal System/Skin & Subcutaneous Tissue", "weight_min_pct": 6, "weight_max_pct": 12, "aliases": ["orthopedics", "rheumatology", "dermatology", "fracture", "arthritis", "rash"],
      "children": [
        { "id": "musculoskeletal", "name": "Musculoskeletal and rheumatology", "aliases": ["orthopedics", "rheumatology", "fracture", "arthritis", "gout", "lupus"] },
        { "id": "skin", "name": "Skin & Subcutaneous Tissue", "aliases": ["dermatology", "rash", "melanoma", "cellulitis"] }
      ]
    },
    { "id": "cardiovascular", "name": "Cardiovascular System", "weight_min_pct": 6, "weight_max_pct": 12, "aliases": ["cardiology", "chest pain", "heart failure", "acs", "arrhythmia", "hypertension"] },
    { "id": "respiratory", "name": "Respiratory System", "weight_min_pct": 5, "weight_max_pct": 10, "aliases": ["pulmonology", "pulm", "asthma", "copd", "pneumonia", "pulmonary embolism"] },
    { "id": "gastrointestinal", "name": "Gastrointestinal System", "weight_min_pct": 5, "weight_max_pct": 10, "aliases": ["gi", "hepatology", "cirrhosis", "gi bleed", "pancreatitis", "ibd"] },
    { "id": "renal-reproductive", "name": "Renal & Urinary System & Reproductive Systems", "weight_min_pct": 7, "weight_max_pct": 13, "aliases": ["nephrology", "urology", "gynecology", "breast", "prostate", "testicular"],
      "children": [
        { "id": "renal", "name": "Renal & Urinary System", "aliases": ["nephrology", "urology", "aki", "ckd", "electrolytes", "uti", "kidney stones"] },
        { "id": "female-reproductive", "name": "Female Reproductive System & Breast", "aliases": ["gynecology", "gyn", "breast", "cervical cancer", "pcos", "amenorrhea"] },
        { "id": "male-reproductive", "name": "Male Reproductive System", "aliases": ["prostate", "testicular", "bph", "erectile"] }
      ]
    },
    { "id": "pregnancy", "name": "Pregnancy, Childbirth & the Puerperium", "weight_min_pct": 3, "weight_max_pct": 7, "aliases": ["obstetrics", "ob", "prenatal", "labor", "postpartum", "preeclampsia"] },
    { "id": "endocrine", "name": "Endocrine System", "weight_min_pct": 3, "weight_max_pct": 7, "aliases": ["endocrinology", "diabetes", "thyroid", "adrenal", "pituitary"] },
    { "id": "multisystem", "name": "Multisystem Processes & Disorders", "weight_min_pct": 4, "weight_max_pct": 8, "aliases": ["infectious disease", "toxicology", "sepsis", "shock", "fluids", "nutrition", "trauma", "poisoning"] },
    { "id": "biostatistics", "name": "Biostatistics & Epidemiology/Population Health/Interpretation of Medical Literature", "weight_min_pct": 3, "weight_max_pct": 5, "aliases": ["biostats", "epidemiology", "study design", "sensitivity", "number needed to treat"] },
    { "id": "social-sciences", "name": "Social Sciences: Legal/Ethical Issues & Professionalism/Systems-based Practice & Patient Safety", "weight_min_pct": 10, "weight_max_pct": 15, "aliases": ["ethics", "patient safety", "quality improvement", "informed consent", "capacity", "medical error", "professionalism"] }
  ]
}
